Network_x,DB_x,Interpreter_x,Logging_x,Data Structure_x,i18n_x,Setup_x,Microservices_x,Test_x,IO_x,UI_x,App_x,prNumber,Network_y,DB_y,Interpreter_y,Logging_y,Data Structure_y,i18n_y,Setup_y,Microservices_y,Test_y,IO_y,UI_y,App_y,issueTitle,issueBody,issue_Comments
1.0,0.0,0.0,1.0,0.0,0.0,0.0,0.0,0.0,1.0,1.0,0.0,4245,1.0,0.0,0.0,1.0,0.0,1.0,0.0,1.0,0.0,1.0,1.0,0.0,fix style issues in about dialog,        ( (      because github does not support autolinking there -->4202 and a few other small style related issues i also created a little new app that make it simple to test the display of javafx controls as of now i only added a lot of buttons in different styles and states:( merge instead of squashing the commits-----  change in changelogmd described-  -  manually tested changed features in running jabref-   ()-  (   ( [helpjabreforg](https://githubcom/jabref/helpjabreforg/issues)?),|| confirmed under windows 10 latest master the window is too small to show the buttons at bottom and you cant resize them( || i digged a bit into this must be related to some binding the change of our dialog layout stuff under the hood the information for authors etc is correctly filled in the variables - so its not the problemin contrast to other dialogs the binding are directly defined in the fxml
0.0,0.0,1.0,1.0,0.0,0.0,0.0,0.0,0.0,1.0,1.0,0.0,4470,0.0,0.0,1.0,1.0,0.0,1.0,0.0,0.0,0.0,1.0,1.0,0.0,3189 fix group renaming,fix group renaming #3189,|| when you close and expand the group the change should also be visible no idea though why it is not visible immediately the same issue occurs if you assign an icon or color to the group || might be related to this: || these bug still exists i will work on it || when i press edit group that show `orgjabrefmodelgroupsabstractgroup#name` instead of `orgjabrefguigroupsgroupnodeviewmodel#displayname` why? whats the difference between them? || the `displayname` is a formatted version of `name` for example if `name` contains latex commands like `hell\{o}` then `displayname` is the unicode version `helló` || this should be fixed in the latest development version could you please check the build from  thanks! please remember to make a backup of your library before trying-out this version || can confirm this has been fixed in:jabref 50-dev--snapshot--2019-01-05--master--d281ece4bwindows 10 100 amd64 java 180_191
1.0,0.0,0.0,1.0,0.0,0.0,0.0,0.0,0.0,1.0,1.0,0.0,4738,1.0,0.0,0.0,1.0,0.0,0.0,0.0,0.0,0.0,1.0,1.0,0.0,adding support for input methods,4474        ( (      because github does not support autolinking there -->-----  change in changelogmd described-  -  manually tested changed features in running jabref-   ()-  (   ( [helpjabreforg](https://githubcom/jabref/helpjabreforg/issues)?),|| the workaround posted in  should work || i would like to work on this issue || thanks to @captaindavinci  this should now be fixed in the latest development versionwe would like to ask you to use a development build from  and report back if it works for you please remember to make a backup of your library before trying-out this version || yes it is fixed thank you!
1.0,0.0,1.0,1.0,0.0,0.0,1.0,0.0,0.0,1.0,1.0,0.0,4758,0.0,0.0,0.0,0.0,0.0,0.0,0.0,0.0,0.0,1.0,1.0,0.0,modifications to improve contrast of ui elements,        ( (      because github does not support autolinking there -->fixes 4583](  change in changelogmd described-  -  manually tested changed features in running jabref-   ()-  (   ( [helpjabreforg](https://githubcom/jabref/helpjabreforg/issues)?),|| hi im interested in working on this issue || thanks to @samiyac this is now implemented in the latest development version could you please check the build from  thanks! please remember to make a backup of your library before trying-out this version
1.0,0.0,1.0,1.0,0.0,0.0,0.0,0.0,0.0,1.0,1.0,0.0,4822,1.0,0.0,1.0,1.0,0.0,0.0,1.0,0.0,0.0,1.0,1.0,0.0,convert autolinkfilesaction to javafx,4819also convert a few other message boxes to javafx        ( (      because github does not support autolinking there -->-----  change in changelogmd described-  -  manually tested changed features in running jabref-   ()-  (   ( [helpjabreforg](https://githubcom/jabref/helpjabreforg/issues)?),
0.0,0.0,1.0,1.0,0.0,0.0,0.0,0.0,0.0,1.0,1.0,0.0,4839,0.0,0.0,1.0,1.0,0.0,0.0,0.0,0.0,0.0,1.0,1.0,0.0,fix parser exception when loading tex-groups with non-existing file,4735 catch file not found exception and handle non existing aux files gracefully        ( (      because github does not support autolinking there -->-----  change in changelogmd described-  -  manually tested changed features in running jabref-   ()-  (   ( [helpjabreforg](https://githubcom/jabref/helpjabreforg/issues)?),|| hi @tobiasdiez i would like to work on this issue || @arturolc ive now fixed this myself as i again run into this problem hope you didnt already started working on this
1.0,0.0,0.0,1.0,0.0,0.0,0.0,0.0,0.0,1.0,1.0,0.0,5123,1.0,0.0,0.0,1.0,0.0,0.0,0.0,0.0,0.0,1.0,1.0,0.0,add search for citations in latex files (back-end and gui),here is a **latex parser tool** that reads each file line by line parses and analyzes them for detecting different citation formatsits user interface consists of a first dialog box that will **ask the user for a directory** to search tex files then the user could **select specific files** after that the tool parses these files and **shows all the bibliographic entries found** in a new dialog box![latex_parser]( issue: 5002](  change in changelogmd described-  -  manually tested changed features in running jabref-   ()-  (   ( [helpjabreforg](https://githubcom/jabref/helpjabreforg/issues)?),|| first of all congratz @davidemdot  if the tex file is related with bib file the solution would become rather complex the workflow would be something like 1 search and find \cite in tex file2 extract the keyword of the related bib entry3 search bibtex file for that keyword and extract the bib entry itself4 list bib entries in jabref main table5 add forward and backward integration for editing bib entriesim nor pro in latex or jabref but always would love to help out in any issues or related workhari || thanks so much @harinda05! i really appreciate your time the workflow that you propose is broadly what it has been planned therefore i am happy to agree with your point of viewwhenever you may have some spare time it would be great if you could have a look at some prototypes please they are shown in this forum thread: particular here is the prototype for finding bibliographic entries:![finding bibliographic entries]( || hi @davidemdot  i tested your additions with my thesis and i found it actually useful 👍 however i found an issue: in the citations search results (and the tab) you show the quoting paragraph in the tooltip as there is no automated linebreak this tooltip becomes very large is there a way to automatically break the paragraph into multiple lines and to shorten long paragraphs into about 5 lines before and after the quotation? long urls probably have to be shortened by force || @calixtushi there!thank you for your quick and positive feedback big point what you commented we will work on it and have a solution as soon as possible![tooltip]( you again! || there is a class called tool tip text util or similar maybe you can add it there || as this is project is now finished and the feature included in the latest development versions ill close this issue feel free to experiment with it and report any problems that you encounter or suggestions for improvement
0.0,0.0,0.0,0.0,0.0,0.0,0.0,0.0,0.0,1.0,1.0,0.0,5210,0.0,0.0,0.0,0.0,0.0,0.0,0.0,0.0,0.0,1.0,1.0,0.0,fix double paste on different os,4845 fixes #4699 fixes #4836 upon pasting macos calls the system paste as well as jabrefframeeditaction#execute() this caused a duplicate call of the paste,|| cannot confirm under windows please try java 8u202 as there have been several bug fixes for mac: || it still persists with latest (18u202) oracle jdk || addon: if an entry is pasted into the maintable it is also pasted twice || reproduced this bug start to work on it  || thanks to @linusdietz  and @stefan-kolb  this issue is now fixed in the latest master!
0.0,0.0,0.0,0.0,0.0,0.0,0.0,0.0,0.0,1.0,1.0,0.0,5210,0.0,0.0,0.0,0.0,0.0,0.0,0.0,0.0,0.0,1.0,1.0,0.0,fix double paste on different os,4845 fixes #4699 fixes #4836 upon pasting macos calls the system paste as well as jabrefframeeditaction#execute() this caused a duplicate call of the paste,|| seems to be only a mac issue on windows 10 i cannot confirm this try updating your java to 8u202 there have been several mac specific fixes || > seems to be only a mac issue on windows 10 i cannot confirm this> try updating your java to 8u202 there have been several mac specific fixesi did the update  however the issue is unaffected || i have a mac os i will investigate it  || @bdcaf  @tobiasdiez  cant reproduce it run jabref via `intellij idea` latest master || thanks to @linusdietz  and @stefan-kolb  this issue is now fixed in the latest master!
0.0,0.0,0.0,1.0,0.0,0.0,0.0,0.0,0.0,1.0,1.0,0.0,5328,0.0,0.0,1.0,1.0,0.0,1.0,0.0,1.0,0.0,1.0,1.0,0.0,improve group coloring and item count,5327 the problem was that `gettreetablerowgetitem()` in `viewmodeltreetablecellfactory` still returned the old item (and not the new one passed as method argument to `updateitem`) since i was already looking at the code this pr also fixes #3112 that improves the coloring after an entry was added to the group also fixes #2857 (at least i couldnt replicate it anymore)        ( (      because github does not support autolinking there -->-----  change in changelogmd described-  -  manually tested changed features in running jabref-   ()-  (   ( [helpjabreforg](https://githubcom/jabref/helpjabreforg/issues)?),|| jabref 50-dev--snapshot--2019-09-18--master--1601770f4windows 10 100 amd64 java 1104-bellsoftthis appears to be fixed in the latest dev version cheers!
1.0,0.0,0.0,1.0,0.0,0.0,0.0,0.0,0.0,1.0,0.0,0.0,925,1.0,0.0,0.0,1.0,1.0,0.0,0.0,0.0,0.0,1.0,0.0,0.0,add tests for metadata parsing,this solves #707 and prepares the way to refactor the metadata classi added a few methods to the metadata class to make testing more convenient many calls to getdata() in fact can be replaced by these new methods i think this is something for a new prone question: to write the tests in a nice way i had to overwrite a few equals methods in particular for the lowercasechanger should i also override equals for all other formatters?,|| seems like this issue has already been fixed 8 months ago high time for closing
0.0,1.0,1.0,1.0,0.0,0.0,0.0,0.0,0.0,1.0,1.0,0.0,937,0.0,1.0,1.0,1.0,0.0,0.0,0.0,0.0,0.0,1.0,1.0,0.0,preview panel is now updated when an entry is cut/deleted,936when an entry is cut/deleted the preview panel will be hidden due to the fact that no entry is selected anymore-  change in changelogmd described?-  ? ( )-  ?-  ?,|| nice video :smile: for reproducing the issue!
1.0,0.0,1.0,1.0,0.0,0.0,1.0,0.0,0.0,1.0,1.0,0.0,1014,1.0,0.0,1.0,1.0,0.0,0.0,1.0,0.0,0.0,1.0,1.0,0.0,improved exception handling in tests cases,never catch an exceptionremoved unnecessary exceptionsthrow specific exceptions never only exceptionref #1012 -  ? ( )-  ?-  ?,|| i just added a corresponding point to the wiki  || i am just going through the tests to check em
1.0,0.0,0.0,1.0,0.0,0.0,0.0,0.0,0.0,1.0,0.0,0.0,1041,1.0,0.0,0.0,1.0,0.0,0.0,0.0,0.0,0.0,1.0,0.0,0.0,write database type in lower case into the bib file,this finally 963 a quick fix has been introduced in 661eea007e555 but that does not cover the lower case writing of the type```@comment{jabref-meta: database_type:bibtex}```finally gets```@comment{jabref-meta: databasetype:bibtex}```-  change in changelogmd described -> this has been introduced in the development versions after the last release thus no entry required-   -> tests have been adapted to match this new implementation,|| you keep `bibtex` and `biblatex` (instead of `bibtex` and `biblatex`) because of  :innocent:
1.0,0.0,1.0,1.0,0.0,0.0,1.0,0.0,0.0,1.0,1.0,0.0,1192,1.0,0.0,1.0,1.0,0.0,0.0,1.0,0.0,0.0,1.0,1.0,0.0,preview panel is now updated when an entry is cut/deleted (again),when i fixed #936 some time ago (pr: #937) i made a tiny errorthe issue was to hide the preview panel when deleting/cutting an entry but it also hid it when aborting the delete-confirmation-dialogi too refactored both actions a little to make it easier for future changesi also removed in `undoableremoveentry` and `undoableinsertentry` the id generation,|| nice video :smile: for reproducing the issue!
1.0,0.0,0.0,1.0,0.0,0.0,0.0,0.0,0.0,1.0,1.0,0.0,1229,1.0,0.0,0.0,1.0,0.0,0.0,0.0,0.0,0.0,1.0,1.0,0.0,1091 apply and ensure correct import sort order,see #1091,|| i just posted this at the pr:maybe you could evaluate that: || we need something like checkstyle which enforces it using gradle we should maybe activate checkstyle for this making the build fail if the imports are not in order  || i looked through some of the source files and have noticed that there is no clear order in which the classes are importedthus i think we firstly need to decide on a proper order (eg first jdk related imports then jabref and after that the rest with a blank line between)furthermore i prefer the fully qualified imports over the generalized ones (*) || checkstyle checks are now in place for forcing one to remove unused imports we can add additional checks eg for the import order but we should be careful not to add to much and only add additional checks as an evolution of the code base see 9e9fc8c || ( || ![image]( || in eclipse automatically generated - use `gradlew eclipse`![grabbed_20160412-143351]( || ![image]( || this is solved do we need to post the intellij configuration at  || did we document this in the wiki? || it is now added at https://githubcom/jabref/jabref/wiki/guidelines-for-setting-up-a-local-workspace#intellij
0.0,0.0,1.0,1.0,0.0,0.0,0.0,0.0,0.0,1.0,1.0,0.0,1388,0.0,0.0,1.0,1.0,0.0,0.0,0.0,0.0,0.0,1.0,1.0,0.0,fix sorting issue #1357,the logic is fucked but this should fix the issueproblem was that when sort in original order was selected the corresponding variable newsortorder would still read the disabled sort order inside the jdialog,|| could you elaborate a bit why you opened and why you closed it? im just curious :) || dont think it makes sense to do it that way we more likely need a controller-based solution for this
1.0,0.0,0.0,1.0,0.0,0.0,0.0,0.0,0.0,1.0,0.0,0.0,1584,0.0,0.0,0.0,0.0,0.0,0.0,0.0,0.0,0.0,0.0,0.0,0.0,added layout dateformatter see #1249,added a configurable layout formatter for dates 1249-  change in changelogmd described-  ,|| so if i understand you correctly you want a formatter which formats the date field to a specific form (say yyyy/mm/dd)? || yes exactly! for now date field is output as yyyy-mm-dd but i would like the possibility to use at mm/yyyy for my documents needs thanks || @meltr biblatex explicitly needs the date format in iso from the biblatex reference manual:  date specifications > the date fields dateorigdateeventdate and urldate require a date> specification in yyyy-mm-dd format date ranges are given as yyyy-mm-dd/yyyy-mm-ddthe formatted display of the date in the citation/bibliography is depending on the biblatex style and language you use and of couse if you provide the arguments:see 311 load-time options for an example || @siedlerchr : @meltr is talking about a layoutformatter to export the bib-file to some other suitable format (or to use with openoffice/libreoffice) || ah now i get it :) it was a bit confusing for me
0.0,0.0,0.0,1.0,0.0,0.0,0.0,0.0,0.0,1.0,1.0,0.0,1888,0.0,0.0,1.0,1.0,0.0,0.0,0.0,0.0,0.0,1.0,1.0,0.0,do not mark a new database as changed,1881  i missed an if-statement when inverting an if/else in #1830 - ~~ change in changelogmd described~~ - introduced in development version only (fortunately)-  manually tested changed features in running jabref,|| this is already the case? _file_ -> _new database_ *- do nothing - *_file_ -> _close database_no message is shown || not in my development version just noticed it so i think it is something quite recent || i can confirm this behaviour in the dev version on windows to || my bad ill add a pr fixing this in a minute
0.0,0.0,0.0,1.0,0.0,0.0,0.0,0.0,0.0,1.0,1.0,0.0,2211,0.0,0.0,0.0,1.0,0.0,0.0,0.0,0.0,0.0,1.0,1.0,0.0,prevent the search to get focus when deleting/pasting an entry,fixes: #2208when you delete an entry the focus will no longer jump to the searchbar instead it will select the next entry (also counts for pasting),|| @bartsch-dev could you have a look? 😇
0.0,0.0,1.0,1.0,0.0,0.0,0.0,0.0,0.0,1.0,1.0,0.0,2554,0.0,0.0,1.0,1.0,0.0,0.0,0.0,0.0,0.0,1.0,1.0,0.0,replaced lrumap with a guava cache,this is intended as a fix for #2546note that the guava caches would allow for automated reloading of the entries but this is not undertaken in this implementation instead everything should work as before with the lrumap-  change in changelogmd described-  -  manually tested changed features in running jabref-   ( [helpjabreforg](https://githubcom/jabref/helpjabreforg/issues)?),|| this can be closed now fixed in #2554
1.0,0.0,1.0,1.0,0.0,0.0,1.0,0.0,0.0,1.0,1.0,0.0,3248,1.0,0.0,1.0,1.0,0.0,0.0,1.0,0.0,0.0,1.0,1.0,0.0,fix for issue 2811: bibtexkey generator does not use crossref information,see #2811 the bibtex key generator now uses crossreferenced entries if required fields are empty-  change in changelogmd described-  -  manually tested changed features in running jabref-   ( [helpjabreforg](https://githubcom/jabref/helpjabreforg/issues)?),|| fixed by #3248
1.0,0.0,0.0,1.0,0.0,0.0,0.0,0.0,0.0,1.0,1.0,0.0,3670,0.0,0.0,0.0,1.0,0.0,0.0,0.0,0.0,1.0,1.0,0.0,1.0,3648: chained modifiers work again,   -->3648 the problem was that `resultinglabel  formatterget()format(label)` always used the original input and not the result of the previous modifier-----  change in changelogmd described-  -   ()-  manually tested changed features in running jabref-   ( [helpjabreforg](https://githubcom/jabref/helpjabreforg/issues)?),|| great thank you very much @tobiasdiez !
1.0,0.0,0.0,1.0,0.0,0.0,0.0,0.0,0.0,1.0,0.0,0.0,3887,1.0,0.0,0.0,1.0,0.0,0.0,0.0,0.0,0.0,1.0,0.0,0.0,improvements around external file types,        ( (      because github does not support autolinking there -->i tried to implement #3885 but changes of the file type in the linked file editor are not saved for some reason ill investigate this again after  is mergedthus only some relative minor code improvements / fixes:- refactor external file type classes and extract a common `externalfiletype` interface- extract all built-in file types to separate enum (implementing `externalfiletype`)- fix display of external file type editor dialog (which is not shown in the current maintable-beta version)-----  change in changelogmd described-  -  manually tested changed features in running jabref-   ()-  (   ( [helpjabreforg](https://githubcom/jabref/helpjabreforg/issues)?),|| i think we need to check/adjust the detection and mark it as online link || we currently have no money to pay someone for that ([donations page]( no one of the jabref team gets paid for jabref thus working on this really depends on the availability of our personal free time - we really welcome feedback on our volunteer work in case you can spend some more time (other than reporting issues) we would really like to encourage you to check  - especially the part asking for improvement of our [help pages]( this would help jabref getting better as a whole 🥇
1.0,0.0,0.0,1.0,0.0,0.0,0.0,0.0,0.0,1.0,0.0,0.0,3970,1.0,0.0,0.0,1.0,0.0,0.0,0.0,0.0,0.0,1.0,0.0,0.0,fixieee,3966  followup from my previous prnow document links  in the format ` are supported tooand i also tested the paper linked in the issue from university network that works fine too         ( (      because github does not support autolinking there -->-----  change in changelogmd described-  -  manually tested changed features in running jabref-   ()-  (   ( [helpjabreforg](https://githubcom/jabref/helpjabreforg/issues)?),|| the test for open access articles such as  workthere should be no difference for the other articles as long as you really have accessit is hard to debug for me as i dont have ieee access at university @jabref/developers anyone of you has access? || i can reproduce this error for me the ieee fetcher tests fail when i am connected using university vpnthe html page  i get from the url downloader talks about missing cookie support i will see if i can fix that  || thank you for reporting this issue we think that is already fixed in our development version and consequently the change will be included in the next releasewe would like to ask you to use a development build from  and report back if it works for you || no please read the text very carefullyi have explicitly mentioned that i am using the latest developmental version the problem still persists please reopen this issue || we just merged a pull request fixing it || @krishnakumarg1984  yes i know but i just merged the code into the master branch the development build gets automatically updated and built by our ci servers whenever someone commits to the master branch this usually takes a couple of minutes the version string contains the first part of the commit id  (help-> about)  || ah i am so sorry for not correctly interpreting what you said i shall try the latest development build and report back sorry for the mild confusion in my last post || @siedlerchr  @stefan-kolb we may have to reopen this issuei just tried with the latest build>>jabref 42-dev--snapshot--2018-04-20--master--8bbc40e13>windows 7 61 x86 >java 180_161from my universitys network and same error pop-up message persists   curiously the event log in jabref is empty i wonder why #3968 says the problem is only with vpn access? i am currently physically on the campus library on a windows 7 machine hard-wired to the network with a lan cable  just to confirm that this is indeed a persisting bug there is no issue with full-text access to this article from a standard browser pointed to the url   || i think @krishnakumarg1984 is right and the issue still persist just looking at the code never going to match ` || hmm thats odd i will look into that again tomorrow  || @krishnakumarg1984  i just merged the fix which supports those the ieee document urls you have like in your entry  and i also tested your entry with university access and worked for me so i would like you to test this again || @siedlerchr  thank you i shall go to university to check this out will report back soon || woohoo you guys are amazing i just tried the latest master-build from my universitys network and can confirm that this is now fixed  was able to download the full-text of the bibtex entry for which the issue was opened thank you for accepting and pro-actively working to fix this issue#### version info of jabref build used:>jabref 42-dev--snapshot--2018-04-21--master--5c664e1d2>windows 7 61 x86 >java 180_161
1.0,0.0,0.0,1.0,0.0,0.0,0.0,0.0,0.0,1.0,1.0,0.0,4311,0.0,0.0,1.0,1.0,0.0,0.0,0.0,1.0,0.0,1.0,1.0,0.0,fix drag and drop in entry editor,43054087 (comment same issue described)consistent with preview panel behavior        ( (      because github does not support autolinking there -->-----  change in changelogmd described-  -  manually tested changed features in running jabref-   ()-  (   ( [helpjabreforg](https://githubcom/jabref/helpjabreforg/issues)?),|| just copy and paste of the preview panel methods
0.0,0.0,0.0,1.0,0.0,0.0,0.0,0.0,0.0,1.0,1.0,0.0,4337,0.0,0.0,0.0,1.0,0.0,0.0,0.0,0.0,0.0,1.0,1.0,0.0,fix export of corporate author to msoffice,fix testsfix  #4329  the underlying problem is the same as in #4152 however i came up with a workaround for msoffice 1 getting the original field2 check for corporate author (braces start and end)3 get latex free value4 readd braces for corporate 5 parse authorthe only edgecase which can occur if the entry starts with an author in latex braces and ends with an author in latex braces that one will probably be interpreted as corporate        ( (      because github does not support autolinking there -->-----  change in changelogmd described-  -  manually tested changed features in running jabref-   ()-  (   ( [helpjabreforg](https://githubcom/jabref/helpjabreforg/issues)?),
0.0,0.0,0.0,1.0,0.0,0.0,0.0,0.0,0.0,1.0,1.0,0.0,4644,1.0,0.0,0.0,0.0,0.0,0.0,0.0,0.0,1.0,1.0,0.0,1.0,fix for issue 4641: remove usage of tempdirectory extension from junit-pioneer,fixes: #4641 removed the tempdirectory extension from junit-pioneer with the built-in extension of junit 54-----  manually tested changed features in running jabref-  (https://githubcom/joelparkerhenderson/git_commit_message),|| i am working on this issue
1.0,0.0,1.0,1.0,0.0,0.0,1.0,0.0,0.0,1.0,1.0,0.0,4696,1.0,0.0,1.0,1.0,0.0,0.0,1.0,0.0,0.0,1.0,1.0,0.0,remove resolve duplicate keys dialog,        ( (      because github does not support autolinking there -->4614removes the resolve duplicate keys dialog this feature is made obsolete by the integrity check and the user can generate new keys very simply (for all entries or only for the duplicated ones) through the entry editor and/or menu-----  change in changelogmd described-  -  manually tested changed features in running jabref-   ()-  (   ( [helpjabreforg](https://githubcom/jabref/helpjabreforg/issues)?),|| good afternooni received the appended windows and error log while opening my data basei think the issue is linked with an attempt from jabref to resolve duplicated keysregardshervé[pb jabreftxt]( jabref]( || a related but not completely identical problem is reported in #4630 || we decided to remove this dialog as the feature is already covered in the integrity check and will be covered in the import dialog
