Network_x,DB_x,Interpreter_x,Logging_x,Data Structure_x,i18n_x,Setup_x,Microservices_x,Test_x,IO_x,UI_x,App_x,prNumber,Network_y,DB_y,Interpreter_y,Logging_y,Data Structure_y,i18n_y,Setup_y,Microservices_y,Test_y,IO_y,UI_y,App_y,issueTitle,issueBody,issue_Comments
0.0,0.0,0.0,1.0,0.0,0.0,0.0,0.0,0.0,1.0,1.0,0.0,4547,1.0,0.0,0.0,0.0,0.0,0.0,0.0,0.0,0.0,1.0,0.0,0.0,do not extract file ending from urls,4544 do not extract file ending from urls,|| thanks to @stefan-kolb  this should be fixed  in the latest masterwe would like to ask you to use a development build from  and report back if it works for you please remember to make a backup of your library before trying-out this version
1.0,0.0,1.0,1.0,0.0,0.0,1.0,0.0,0.0,1.0,1.0,0.0,4731,1.0,0.0,1.0,1.0,0.0,0.0,1.0,0.0,0.0,1.0,1.0,0.0,fix default import format pattern,remove display arrayadd migration4724        ( (      because github does not support autolinking there -->-----  change in changelogmd described-  -  manually tested changed features in running jabref-   ()-  (   ( [helpjabreforg](https://githubcom/jabref/helpjabreforg/issues)?),|| this issue should be fixed now in the lastet masterwe would like to ask you to use a development build from  and report back if it works for you please remember to make a backup of your library before trying-out this version || yep the defaults are now correct thanks!
0.0,0.0,1.0,1.0,0.0,0.0,0.0,0.0,0.0,1.0,1.0,0.0,4761,1.0,0.0,1.0,1.0,0.0,0.0,1.0,0.0,0.0,1.0,1.0,0.0,enable import button only if entry selected,        ( (      because github does not support autolinking there -->fixes 4755](  change in changelogmd described-  -  manually tested changed features in running jabref-   ()-  (   ( [helpjabreforg](https://githubcom/jabref/helpjabreforg/issues)?),|| i would like to work on this issue || @samiyac glad to hear!you should be able to get the button via `(button) thisgetdialogpane()lookupbutton()` then it is probably enough to bind the `disableproperty` to the `emptyproperty` of the list of checked items
0.0,0.0,0.0,1.0,0.0,0.0,0.0,0.0,0.0,1.0,1.0,0.0,5195,1.0,0.0,0.0,1.0,0.0,0.0,0.0,0.0,1.0,1.0,0.0,0.0,add citation commands to texparser,we added a few more citation commands: `autocite` `autocite` `blockcquote` and `textcquote`this pr 5194-----  change in changelogmd described-  -  manually tested changed features in running jabref-   ()-  (   ( [helpjabreforg](https://githubcom/jabref/helpjabreforg/issues)?),
0.0,0.0,1.0,1.0,0.0,0.0,0.0,0.0,0.0,1.0,1.0,0.0,5354,0.0,0.0,0.0,0.0,0.0,0.0,0.0,0.0,0.0,0.0,1.0,0.0,fix group color when scrolling,5022 problem was that the pseudo-class was not initialized correctly but was only triggered upon changes        ( (      because github does not support autolinking there -->-----  change in changelogmd described-  -  manually tested changed features in running jabref-   ()-  (   ( [helpjabreforg](https://githubcom/jabref/helpjabreforg/issues)?),
0.0,0.0,1.0,1.0,0.0,0.0,0.0,0.0,0.0,1.0,1.0,0.0,2169,1.0,0.0,0.0,0.0,0.0,0.0,0.0,0.0,1.0,0.0,0.0,1.0,fix failing ads test,added missing fields 2168,|| should we separate the fetcher tests from the normal tests? similar to thedatabase and integration tests? this would enable a separation and keepavoid failing tests being unrelated to a certain pr
1.0,0.0,1.0,1.0,0.0,0.0,1.0,0.0,0.0,1.0,1.0,0.0,2816,1.0,0.0,1.0,1.0,0.0,0.0,1.0,0.0,0.0,1.0,1.0,0.0,2806: date editor also accepts incomplete dates,   -->should fix  and   change in changelogmd described-  -   ()-  manually tested changed features in running jabref-   ( [helpjabreforg](  if you changed the localization: did you run `gradle ate`?,
1.0,0.0,0.0,1.0,0.0,0.0,0.0,0.0,0.0,1.0,0.0,0.0,3203,1.0,0.0,0.0,1.0,0.0,0.0,0.0,0.0,0.0,1.0,0.0,0.0,when groups are removed also remove them from entries,3190-  change in changelogmd described-  -   ()-  manually tested changed features in running jabref-   ( [helpjabreforg](  if you changed the localization: did you run `gradle ate`?,|| this is a bug it is reproducible while removing or changing group name from entry editor works fine but from groups menu it shows unexpected behaviour
1.0,0.0,0.0,1.0,0.0,0.0,0.0,0.0,0.0,1.0,0.0,0.0,3388,1.0,0.0,0.0,1.0,0.0,0.0,0.0,0.0,0.0,1.0,0.0,0.0,added checking integrity dialog,this change is related to #3358 jabref looked like it is hanging during long integrity checks i added a dialog with a progress bar to show that it is working![checkingintegrity](  change in changelogmd described-  -   ()-  manually tested changed features in running jabref-   ( [helpjabreforg](  if you changed the localization: did you run `gradle ate`?,
0.0,0.0,1.0,1.0,0.0,0.0,0.0,0.0,0.0,1.0,1.0,0.0,3502,0.0,0.0,1.0,1.0,0.0,0.0,0.0,0.0,0.0,1.0,1.0,0.0,update user agent and change acm to https,fix acm fetcher3500    -->-----  change in changelogmd described-  -   ()-  manually tested changed features in running jabref-   ( [helpjabreforg](  if you changed the localization: did you run `gradle ate`?,|| i can only reproduce the fetcher bug itself seems like there has been an update to the acm page  || the outdated jdk version could be part of the problem the latest development snapshot should display a warning that says that you need at least 180_144
1.0,0.0,0.0,1.0,0.0,0.0,0.0,0.0,0.0,1.0,1.0,0.0,3539,0.0,0.0,0.0,1.0,0.0,0.0,0.0,0.0,0.0,0.0,1.0,0.0,fix options databinding by adding elements if they are not in the initial map,3538 i dunno if this is the best idea but it works   -->-----  change in changelogmd described-  -   ()-  manually tested changed features in running jabref-   ( [helpjabreforg](  if you changed the localization: did you run `gradle ate`?,
0.0,0.0,0.0,1.0,0.0,0.0,0.0,0.0,0.0,1.0,1.0,0.0,4860,0.0,0.0,0.0,1.0,0.0,0.0,0.0,0.0,0.0,1.0,1.0,0.0,remove deprecated awt apple extension,3905        ( (      because github does not support autolinking there -->-----  change in changelogmd described-  -  manually tested changed features in running jabref-   ()-  (   ( [helpjabreforg](https://githubcom/jabref/helpjabreforg/issues)?),|| at least with java 9 they are obsolete and with javafx no longer needed but we still have one or two dialogs who use them  || refs #3861  || so full steam ahead for the javafx migration 🎉  || refs #3421
0.0,1.0,1.0,1.0,0.0,0.0,0.0,0.0,0.0,1.0,1.0,0.0,2229,0.0,0.0,1.0,1.0,0.0,0.0,0.0,0.0,0.0,1.0,1.0,0.0,fix medline fetcher by using https,fix for #2228 -  change in changelogmd described-   ( [helpjabreforg](  write blog post regarding  november 9 2016 ncbi  servers will redirect or reject all  requests,|| was about to fix that too -)changing the urls in `medlinefetcherjava` is sufficientplease also provide a changelog entry as this change will break previous jabref versionsmore information at pubmed:  || we should also make an announcement since: > after november 9 2016 ncbi  servers will redirect or reject all  requestshttps://wwwncbinlmnihgov/home/develop/https-guidanceshtml
1.0,0.0,1.0,1.0,0.0,0.0,1.0,0.0,0.0,1.0,1.0,0.0,2921,1.0,0.0,1.0,1.0,0.0,0.0,1.0,0.0,0.0,1.0,1.0,0.0,2854: readd context menu to linked files editor,   -->this was the last feature missing from the old file list editor the old class could thus be deleted-  change in changelogmd described-  -   ()-  manually tested changed features in running jabref-   ( [helpjabreforg](  if you changed the localization: did you run `gradle ate`?,|| the filelisteditor needs to be apdated to javafx
1.0,0.0,1.0,1.0,0.0,0.0,1.0,0.0,0.0,1.0,1.0,0.0,3211,1.0,0.0,1.0,1.0,0.0,0.0,1.0,0.0,0.0,1.0,1.0,0.0,added logic to check whether linked file already exists,#3172 added a check in linkedfileviewmodelrename() to see if a file which isbeing renamed already exists in the target location if such a file isfound then an error popup displays informing the user of the conflictuser will be prompted to choose whether to overwrite or cancelalso see #3188 for additional details,|| have a look at ```public class linkedfileviewmodel extends abstractviewmodel { public void rename() { ``` || it sounds like adding a check for existing files in that directory with the targetfilename and then showing the error dialog would take care of this  i can fix this fairly quickly want me to work on it? || didnt take very long at all actually![samefilenameerror]( || yeah cool stuff! just open the pr and well have a look at it! || fixed in #3211 thanks @andrew-lev!
1.0,1.0,0.0,1.0,0.0,0.0,0.0,0.0,0.0,1.0,1.0,1.0,5539,1.0,1.0,0.0,1.0,0.0,0.0,0.0,0.0,1.0,1.0,1.0,1.0,improve performance,improve performance by:- caching fields as keywordlist- remove duplicate change listener- remove preference access in loopwith these changes the mega huge library of @aegit works without too much delays (the initial loading of the database is a bit slow but still ok) thus this pr is a potential fix for #4430 and for  describe the changes you have made here:        ( (      because github does not support autolinking there -->-----  change in changelogmd described-  -  manually tested changed features in running jabref-   ()-  (   ( [helpjabreforg](https://githubcom/jabref/helpjabreforg/issues)?),|| the changing of group is still slow and causes a spike in cpu load  tested with a large database o 6400 entries and many groups memory is not an issue( || can confirm - i might have time during this weekend to run some additional performance test unfortunately my yourkit java profiler test license ran out so i will probably have to create a new virtual machine and run a new installation of yourkit in there - unless someone else knows a method to extend the evaluation period a little? i dont really need the tool except for showing the performance issues in the current jabref version compared to version 382 || this should be fixed now a few remaining performance issues are mentioned at  || jabref 500-dev--2019-11-28----ce0e8870cwindows 10 100 amd64 java 1301this issue indeed appears to be fixed in the current version of jabref (the remaining issues can be found here:  big shout out to @tobiasdiez for the continuous support!
0.0,0.0,0.0,1.0,0.0,0.0,0.0,0.0,0.0,1.0,1.0,0.0,1970,0.0,0.0,0.0,0.0,0.0,0.0,0.0,0.0,0.0,0.0,0.0,0.0,1958: verbatim url field is no longer checked for html encoded chars,-  change in changelogmd described-  -  manually tested changed features in running jabref,|| integrity check for url should be disabled generally at least in biblatex all url related fields are treated as verbatim || there is `fieldpropertyverbatim` that can be used as there are more fields which are verbatim in biblatex || like this? `if (!internalbibtexfieldsgetfieldproperties(fieldgetkey())contains(fieldpropertyverbatim)) {`
1.0,0.0,0.0,1.0,0.0,0.0,0.0,0.0,0.0,1.0,1.0,0.0,5670,1.0,0.0,0.0,1.0,0.0,0.0,0.0,0.0,1.0,1.0,1.0,1.0,improve column preference migration,    #333 : 47]( title of the pr must not reference an issue because github does not support autolinking there-->5661<!-- - all items with `` are still a todo-  `` - remove items not applicable-->-  change in changelogmd described (if applicable)-  -  -   ()-  [](   <https://githubcom/jabref/user-documentation/issues>,|| @calixtus  you recently worked on this feature? || oh thanks didnt see that thanks for the fixsorry that im not much of help at the moment i submitted my thesis and im learning for my exams in the end of january maybe ive got some time in christmas-holidays
0.0,0.0,0.0,1.0,0.0,0.0,0.0,0.0,0.0,1.0,1.0,0.0,4011,0.0,0.0,0.0,1.0,0.0,0.0,0.0,0.0,0.0,1.0,1.0,0.0,reimplement tooltips for file and identifier columns,this 3973reimplements tooltips for file- url-/doi- and eprint-column in the maintable-beta-----  change in changelogmd described-  -  manually tested changed features in running jabref-   ()-  (   ( [helpjabreforg](https://githubcom/jabref/helpjabreforg/issues)?),|| fixed by #4011
0.0,0.0,1.0,1.0,0.0,0.0,0.0,0.0,0.0,1.0,1.0,0.0,5326,1.0,0.0,1.0,1.0,0.0,1.0,0.0,1.0,0.0,1.0,1.0,0.0,fix problem with search and switching between libraries,4846 by using bindings instead of listeners        ( (      because github does not support autolinking there -->-----  change in changelogmd described-  -  manually tested changed features in running jabref-   ()-  (   ( [helpjabreforg](https://githubcom/jabref/helpjabreforg/issues)?),|| @bdcafi recently worked on the search feature and i would like you to try out this version here and report back if it is now working for you: || did a quick test  unfortunately it still restores the deleted search || thanks for your feedback will look into this in #4897  || this should be fixed in the latest development version could you please check the build from  thanks! please remember to make a backup of your library before trying-out this version
