Network_x,DB_x,Interpreter_x,Logging_x,Data Structure_x,i18n_x,Setup_x,Microservices_x,Test_x,IO_x,UI_x,App_x,prNumber,Network_y,DB_y,Interpreter_y,Logging_y,Data Structure_y,i18n_y,Setup_y,Microservices_y,Test_y,IO_y,UI_y,App_y,issueTitle,issueBody,issue_Comments
0.0,0.0,1.0,1.0,0.0,0.0,0.0,0.0,0.0,1.0,1.0,0.0,5086,1.0,0.0,0.0,1.0,0.0,0.0,0.0,0.0,0.0,0.0,1.0,0.0,bugfix/5045 : modified the existing logic to comply crossref resolution with biblatex specification,5045        ( (      because github does not support autolinking there -->-----  change in changelogmd described-  -  manually tested changed features in running jabref-   ()-  (   ( [helpjabreforg](https://githubcom/jabref/helpjabreforg/issues)?),|| as of now jabref simply takes the value of the same field from the referenced entry these advanced mappings of biblatex are not yet taken into accountthe following code needs to be adapted: || @tobiasdiez ill work on this issue || @tobiasdiez pr  is open for review || thanks to @cyraxsector  this should be fixed now in the latest master  || thanks for your effort unfortunately this does not work for me in the latest master see the [attached mwe]( for testingjabref 50-dev--snapshot--2019-08-26--master--b2e6e8383linux 440-159-generic amd64 java 1104 || thanks to you this should be fixed in the latest development version 😸  could you please check the build from  thanks! please remember to make a backup of your library before trying-out this version
0.0,0.0,1.0,1.0,0.0,0.0,0.0,0.0,0.0,1.0,1.0,0.0,5229,0.0,0.0,0.0,0.0,0.0,0.0,0.0,0.0,0.0,0.0,0.0,0.0,add doi url eprint  field to general tab layout,4612        ( (      because github does not support autolinking there -->-----  change in changelogmd described-  -  manually tested changed features in running jabref-   ()-  (   ( [helpjabreforg](https://githubcom/jabref/helpjabreforg/issues)?),|| applies only to bibtex i think || this should be a preferences issue only as it can be configured via options -> setup general fields || this has really high priority as we do every fetching based on the doi fields! || > applies only to bibtex i thinkapplies to both modes as far as i can see
0.0,0.0,0.0,0.0,0.0,0.0,0.0,0.0,0.0,0.0,0.0,0.0,5266,0.0,0.0,0.0,0.0,0.0,0.0,0.0,0.0,0.0,0.0,0.0,0.0,issue #5223,issue #5223 add @software and  @dataset entrytype as an option in the biblatex and bibtex add fields eventitle eventdate and venue to @unpublished entry type i used the misc set of fields to supplement software and dataset couldnt find documentation about specific fields that should be included in @software and @dataset entry type ![entrytype](  change in changelogmd described-  -  manually tested changed features in running jabref-   ()-  (   ( [helpjabreforg](https://githubcom/jabref/helpjabreforg/issues)?),|| please send the bib file to me my email should appear on my github site:  || as reported to koppor:the ranks were shown one day later may be it was caused somehow by either the very first start of jabref or importing preferences without restarting jabref || @teertinker so everything is fine for you now?@koppor could you reproduce the issue with the bib file? if not i would suggest to close the issue for now || everything works for me now it was not a problem of my bib file it was either related to loading my bib file the first time with jabref 30 or importing preferences without restarting jabref in either case the reported issue isnt one
0.0,0.0,0.0,0.0,0.0,0.0,0.0,0.0,0.0,0.0,0.0,0.0,5266,0.0,0.0,0.0,0.0,0.0,0.0,0.0,0.0,0.0,0.0,0.0,0.0,issue #5223,issue #5223 add @software and  @dataset entrytype as an option in the biblatex and bibtex add fields eventitle eventdate and venue to @unpublished entry type i used the misc set of fields to supplement software and dataset couldnt find documentation about specific fields that should be included in @software and @dataset entry type ![entrytype](  change in changelogmd described-  -  manually tested changed features in running jabref-   ()-  (   ( [helpjabreforg](https://githubcom/jabref/helpjabreforg/issues)?),|| thank you for reporting this issue we think that is already fixed in our development version and consequently the change will be included in the next releasewe would like to ask you to use a development build from  and report back if it works for you please remember to make a backup of your library before trying-out this version
0.0,0.0,0.0,1.0,0.0,0.0,0.0,0.0,0.0,1.0,1.0,0.0,5352,0.0,0.0,0.0,1.0,0.0,0.0,0.0,0.0,0.0,1.0,1.0,0.0,bring back the context menu,as explained in  it is no longer possible to customize the context menu items because the classes related to the text field behavior are not accessible thus instead i simply copied the relevant code from openjdk pretty ugly workaround 5254 and refs  i removed the custom tab handling because it is now working as expected (ie #2902 is fixed in java 9+)        ( (      because github does not support autolinking there -->-----  change in changelogmd described-  -  manually tested changed features in running jabref-   ()-  (   ( [helpjabreforg](https://githubcom/jabref/helpjabreforg/issues)?),|| (: @matthiasgeiger  || attention!shift+tab usually moves the cursor to the _previous_ field on the contrary tab moves to the _following_ tabtherefore i suggest to keep unmodified the behaviour of shift+tab but to add the usual behavior of the tab button || this should be fixed in the latest development version could you please check the build from  thanks! || checked right now v 40 beta2 and working!many thanks!
1.0,0.0,1.0,1.0,0.0,0.0,0.0,0.0,0.0,1.0,1.0,0.0,5519,1.0,0.0,1.0,1.0,0.0,0.0,0.0,0.0,1.0,1.0,1.0,1.0,fix xmp null error,5449 was caused by wrapping a set of fields in a treeset without specifying the comparator        ( (      because github does not support autolinking there -->-----  change in changelogmd described-  -  manually tested changed features in running jabref-   ()-  (   ( [helpjabreforg](https://githubcom/jabref/helpjabreforg/issues)?),|| @homocomputeris are the pdfs freely available? it would be nice if you added them via a pr so that we can create test cases- pdf directory for tests:  bib files:  (or add the bib files as skeleton java code or just as text in the pr) || the one from my snippet is  it doesnt write to any pdffor example from these links i downloaded jabref-authorsbib and one pdf and say i want to write the 1st entry metadata to the pdf:```garridokallstromkummetal2016  error while writing /home/user/documents/literature/thesis-examplepdf:    nullfinished writing xmp for 0 file (0 skipped 1 errors)``` || i tried it today with the latest snapshot on windows 10: the same `null` error is raised || thanks to @tobiasdiez  this issue should be fixed nowwe would like to ask you to use a development build from  and report back if it works for you please remember to make a backup of your library before trying-out this version
1.0,1.0,0.0,1.0,0.0,0.0,0.0,0.0,1.0,1.0,1.0,1.0,1168,1.0,1.0,0.0,1.0,0.0,0.0,0.0,0.0,1.0,1.0,1.0,1.0,1163 by removing the strange functionality which enabled sorting…,we have some very strange logic in jabref which allows to handle years using only the two last numbers so we can detect that 68 means 1968 this causes a lot of issues i do not think that jabref should still support such strange logic and just use the value which is in the year field hence i removed it this also solves the issue of having that yearutil in the model package which duplicated a method in the stringutil class refs #1163,
0.0,0.0,1.0,1.0,0.0,0.0,0.0,0.0,0.0,1.0,1.0,0.0,1440,0.0,0.0,0.0,0.0,0.0,0.0,0.0,0.0,1.0,1.0,0.0,1.0,1420 auto downloader should respect file pattern and propose correct filename,(https://cloudentcom/assets/2141507/15472274/898030a4-20fa-11e6-9a77-8cfac10688d5png),
0.0,0.0,1.0,1.0,0.0,0.0,0.0,0.0,0.0,1.0,1.0,0.0,1443,0.0,0.0,1.0,1.0,0.0,0.0,0.0,0.0,0.0,1.0,1.0,0.0,651: improve parsing of author names containing braces,651-  change in changelogmd described-  -   (),|| yeapi remove all the latex stuf and opened ok (the eof error persist) || one should probably use the bibtex-vm-based name formatters || note that the above is a bad example since the correct way to write the acute accent is `\{e}` and `h\{e}l\grave{e}ne fiaux` is correctly written as `fiaux h`however `h{e}lene fiaux` results in the unexpected `fiaux he` || i propose to close this as it is only a very minor bug which only occurs in very special circumstances with bad input any objections @jabref/developers ?
0.0,0.0,1.0,1.0,0.0,0.0,0.0,0.0,0.0,1.0,1.0,0.0,1487,0.0,0.0,1.0,1.0,0.0,0.0,0.0,0.0,0.0,1.0,1.0,0.0,implement getextension and getdescription for importers,implement getextension and getdescription for importers #1444 -  change in changelogmd described-  ,|| should be fixed by #1487 isnt it?
0.0,0.0,0.0,1.0,0.0,0.0,0.0,0.0,0.0,1.0,1.0,0.0,2114,0.0,0.0,1.0,1.0,0.0,0.0,0.0,1.0,0.0,1.0,1.0,0.0,ctrl-s parsing error message,2109 ctrl-s doesnt trigger parsing error messageproblem: conflict of local shortcut (of the entry editor) with the global shortcutsolution: local shortcut removed (the action assigned to local and global shortcut is essentially the same (save database))-  change in changelogmd described-  -   ()-  manually tested changed features in running jabref-   ( [helpjabreforg](  if you changed the localization: did you run `gradle ate`?,
0.0,0.0,0.0,1.0,0.0,0.0,0.0,0.0,0.0,1.0,1.0,0.0,2226,0.0,0.0,0.0,1.0,0.0,0.0,0.0,0.0,0.0,1.0,1.0,0.0,fix for #2218: reenable ads fetcher,(see #2218)fetcher is now working again- ~~ change in changelogmd described~~ affected search based fetcher still unreleased-  tests ~~created for changes~~ pass again- ~~  ()~~-  manually tested changed features in running jabref- ~~  ( [helpjabreforg]( ~~ if you changed the localization: did you run `gradle ate`?~~,|| potential quickfix: user agent? || maybe you can go ahead and try! || not from my smartphone :wink:
1.0,0.0,0.0,1.0,0.0,0.0,0.0,0.0,0.0,1.0,1.0,0.0,3325,1.0,0.0,0.0,1.0,0.0,0.0,0.0,0.0,0.0,1.0,1.0,0.0,3292: annotations are now automatically refreshed,   -->this pr aims to 3292 by removing the refresh button completely and monitoring the pdf files automatically for changes in the progress of the implementation a few refactorings were made:- extract the file monitoring functionality from `fileupdatemonitor` to a new class and convert the timestamp-based method to the new nio watcher interface- extract the conflict handling code by external bib file changes from the base panel to a new class `databasechangemonitor` where also some of the old code from `fileupdatemonitor` now finds a new home this class is still a bit ugly but in my opinion better than before i hope that the conflict handling still works as expected i tested it but might have missed some special cases/configurations------  change in changelogmd described-  -   ()-  manually tested changed features in running jabref-   ( [helpjabreforg](  if you changed the localization: did you run `gradle ate`?,
1.0,0.0,0.0,1.0,0.0,0.0,0.0,0.0,0.0,1.0,1.0,0.0,3931,1.0,0.0,0.0,1.0,0.0,0.0,0.0,0.0,0.0,1.0,1.0,0.0,3929 correct fetcher messages,3929,
1.0,0.0,0.0,1.0,0.0,0.0,0.0,0.0,0.0,1.0,1.0,0.0,4549,1.0,0.0,0.0,1.0,0.0,0.0,0.0,0.0,0.0,1.0,1.0,0.0,fixes that renaming a group did not change the group name in the interface,3189,|| when you close and expand the group the change should also be visible no idea though why it is not visible immediately the same issue occurs if you assign an icon or color to the group || might be related to this: || these bug still exists i will work on it || when i press edit group that show `orgjabrefmodelgroupsabstractgroup#name` instead of `orgjabrefguigroupsgroupnodeviewmodel#displayname` why? whats the difference between them? || the `displayname` is a formatted version of `name` for example if `name` contains latex commands like `hell\{o}` then `displayname` is the unicode version `helló` || this should be fixed in the latest development version could you please check the build from  thanks! please remember to make a backup of your library before trying-out this version || can confirm this has been fixed in:jabref 50-dev--snapshot--2019-01-05--master--d281ece4bwindows 10 100 amd64 java 180_191
1.0,0.0,1.0,1.0,0.0,0.0,1.0,0.0,0.0,1.0,1.0,0.0,4604,1.0,0.0,1.0,1.0,0.0,0.0,1.0,0.0,0.0,1.0,1.0,0.0,enable default cursor for new entry,4600sets text field on focus at the end of initialization by running the javafx thread-----  change in changelogmd described-  -  manually tested changed features in running jabref-   ()-  (   ( [helpjabreforg](https://githubcom/jabref/helpjabreforg/issues)?),|| thanks to @chelseyong this is now implemented in the latest development version could you please check the build from  thanks! please remember to make a backup of your library before trying-out this version
0.0,0.0,1.0,1.0,0.0,0.0,0.0,0.0,0.0,1.0,1.0,0.0,4964,0.0,0.0,1.0,1.0,0.0,0.0,0.0,0.0,0.0,1.0,1.0,0.0,remove ui threadlist for maintable as it prevents sorting in maintable,4886renenables sortingtried a bit around and could not find any side issue so far        ( (      because github does not support autolinking there -->-----  change in changelogmd described-  -  manually tested changed features in running jabref-   ()-  (   ( [helpjabreforg](https://githubcom/jabref/helpjabreforg/issues)?),|| thanks for the report that is definitely a regression bug it was working fine a few versions ago if i remember correctlyedit// confirmed on windows 10 with 47f43ca63616f04bfa780c9a8d83143d919d1f80 tjabref 50-devwindows 10 100 amd64 java 180_202 || @tobiasdiez  i found the issue: in the maintable if i remove the bindings wrapper it works again``` thissetitems(bindingshelperforui(modelgetentriesfilteredandsorted()))        // enable sorting        modelgetentriesfilteredandsorted()comparatorproperty()bind(thiscomparatorproperty())``` || the issue is not solved in the latest snapshot of today (`2019-05-06 c168c4978`) || @siedlerchr @tobiasdiez what is the problem with this why is the correction not yet applied? it renders my working with jabref very difficult the version snapshot--2019-05-10--master--751c5b5e7 does not have sorting back || please be patient!  we understand that this is an important issue as long as the issue is not closed its not fixed no need to constantly question it  come on you know the ruleswhile the fix looks simple it might have other consequences which we need to check but i will look at it in detail now || should be fixe now in the latest master 3baa6bd we would like to ask you to use a development build from  and report back if it works for you please remember to make a backup of your library before trying-out this version || great it works! thanks
1.0,0.0,1.0,1.0,0.0,0.0,1.0,0.0,0.0,1.0,1.0,0.0,4999,1.0,0.0,1.0,1.0,0.0,0.0,1.0,0.0,0.0,1.0,1.0,0.0,fix iee fetcher,4997 add exception dialog on import failcheck if we have keywords field present in json        ( (      because github does not support autolinking there -->-----  change in changelogmd described-  -  manually tested changed features in running jabref-   ()-  (   ( [helpjabreforg](https://githubcom/jabref/helpjabreforg/issues)?),|| thanks for your report! this was indeed a bug in the ieee fetcher in addtion if any fetcher throws an error it will be displayed in a dialog nowwe would like to ask you to use a development build from  and report back if it works for you please remember to make a backup of your library before trying-out this version
1.0,0.0,0.0,1.0,0.0,0.0,0.0,0.0,0.0,1.0,0.0,0.0,5048,1.0,0.0,0.0,1.0,0.0,0.0,0.0,0.0,0.0,1.0,0.0,0.0,preserve encoding while copy and pasting in maintable,5043encodes and decodes data with utf-8,|| first tests show that copying is fine but pasting alters the encoding via a bibtex parser || i can still reproduce the problem with today `jabref_windows-x64_5_0-dev--snapshot--2019-06-16--master--8d99db113` || the pr is not merged yet you can try the branch version if you like  || it is fixed thanks a lot!**edit**: but wait there is another bug maybe related to this issue here i will test and report**edit2**: the bug #5069 is not related to this issue can be closed if merged || merged this now into master so will be avaiable in a couple of minutes in the master version
1.0,0.0,1.0,0.0,0.0,0.0,0.0,1.0,0.0,0.0,1.0,0.0,5454,1.0,0.0,1.0,0.0,0.0,0.0,0.0,1.0,0.0,0.0,1.0,0.0,fix highlight issues for lists,5277 and fixes #5035 the problem was in both cases that the list view reuses nodes when scrolling (instead of creating new ones)        ( (      because github does not support autolinking there -->-----  change in changelogmd described-  -  manually tested changed features in running jabref-   ()-  (   ( [helpjabreforg](https://githubcom/jabref/helpjabreforg/issues)?),|| @tobiasdiez im working on this
1.0,0.0,1.0,0.0,0.0,0.0,0.0,1.0,0.0,0.0,1.0,0.0,5454,1.0,0.0,1.0,0.0,0.0,0.0,0.0,1.0,0.0,0.0,1.0,0.0,fix highlight issues for lists,5277 and fixes #5035 the problem was in both cases that the list view reuses nodes when scrolling (instead of creating new ones)        ( (      because github does not support autolinking there -->-----  change in changelogmd described-  -  manually tested changed features in running jabref-   ()-  (   ( [helpjabreforg](https://githubcom/jabref/helpjabreforg/issues)?),|| jabref 50-devlinux 500-27-generic amd64 java 180_222cannot reproduce the behaviour mentioned above i reckon this has now been fixed with  (?) || i will start investigations on this || jabref 50-devlinux 500-27-generic amd64 java 1104ok i can now reproduce this behaviour with the current snap version on the --edge channel this indicates that this issue was introduced somewhere between the release of the current snap version (or rather the one from 9th september) on the --beta channel and the current snap version on the --edge channel || @cyraxsector  you can try to narrow down the bug a git bisect: || cannot reproduce the behavior mentioned above can you please provide more information || jabref 50-dev--snapshot--2019-09-26--master--1a6c92c79windows 10 100 amd64 java 1104-bellsofti can still reproduce this behaviour you can force it to happen by scrolling with the mouse wheel in the fetcher sidepane and then switching back to just scrolling with the mouseif you just scroll with the mouse (without using the mouse wheel) you will sometimes encounter the issue and sometimes not but by using the mouse wheel scrolling first and then the mouse scrolling itself afterwards the issue always appears || this should be fixed in the latest development version could you please check the build from  thanks! please remember to make a backup of your library before trying-out this version || jabref 500-dev--2019-10-18----bc26c3ac5windows 10 100 amd64 java 1202i can confirm that this has been fixed in the current dev version
1.0,0.0,1.0,1.0,0.0,0.0,0.0,0.0,0.0,1.0,1.0,0.0,5472,1.0,0.0,0.0,1.0,0.0,0.0,0.0,0.0,0.0,0.0,1.0,0.0,fix highlight problem in entry preview,5069 by using markjs        ( (      because github does not support autolinking there -->-----  change in changelogmd described-  -  manually tested changed features in running jabref-   ()-  (   ( [helpjabreforg](https://githubcom/jabref/helpjabreforg/issues)?),|| issues is from the search highlighting of the search term when you stop searching its back to normal  || the highlighting is handled by this simple javascript code: || i know nothing about jswhat does your last post mean? it is easy to fix or the opposite? || i have tried if this issue still remains in the master branch and not only does it lose formatting it also jumps to the author field automatically so i am rewriting my author after search finds a resultthe formatting goes back to normal when i click to other article not after finishing search as @siedlerchr saidi would like to look at this issue and fix it || the problem is probably that we read the inner text (ie everything without formatting) and then set it as the inner html should work if `documentbodyinnertext` is replaced by `documentbodyinnerhtml` || @tobiasdiez  it is not that easy thats what i did before the problem is then that it displays and searches matches in html tags  || this should be fixed in the latest development version could you please check the build from  thanks! please remember to make a backup of your library before trying-out this version || confirmed it is fixed and working for methanks a lot
0.0,0.0,0.0,1.0,0.0,0.0,0.0,0.0,0.0,1.0,1.0,0.0,5680,0.0,0.0,0.0,1.0,0.0,0.0,0.0,0.0,0.0,0.0,0.0,0.0,add throttle to autosaveuimanager,as discussed in #5679 there are a lot of save actions performed when autosave is turned on this pr adds a timer which limits the save actions to one in 200ms which is especially handy when automated tasks like find and replace are performed-  change in changelogmd described (if applicable)-  ,
0.0,0.0,0.0,1.0,0.0,0.0,0.0,0.0,0.0,1.0,1.0,0.0,1950,1.0,0.0,0.0,0.0,0.0,0.0,0.0,0.0,1.0,1.0,0.0,1.0,towards hierarchical keywords,   -->this pr is the first step towards supporting hierarchical keywords #628 -  refactor the keyword-related code to use new classes `keywordlist` and `keyword` -  unified keyword delimiter to be a single character and in this way fixed the issues mentioned in #705 and #1877-  move keyword delimiter from preferences to metadata (database properties) -> new pr-  add hierarchical delimiter and change parsing logic in `keywordlist` accordingly -> new pr-  change ui to support hierarchical keywords -> new prnote: i also moved the stringutil class to model (in some sense it is jabrefs own string class) and removed entryutil (only had methods related to strings (-> stringutil) or keywords (-> keywordlist) )-  change in changelogmd described-  -   ()-  manually tested changed features in running jabref-   ( [helpjabreforg](https://githubcom/jabref/helpjabreforg/issues)?),|| string tokenizer ist really really legacy code  should either be stringsplit or scanner || and in medlineimporter the author decided to use `` as separator and ignore the preferences (the separator from the preferences is available in importformatpreferences) || addressed in #1950
1.0,0.0,0.0,1.0,0.0,0.0,0.0,0.0,0.0,1.0,1.0,0.0,2891,1.0,0.0,0.0,0.0,0.0,0.0,0.0,0.0,1.0,0.0,0.0,1.0,adjust tests: ads fetcher returns url dblp no longer works with negative operators,#2890internal change only some adjusted tests,|| fixed in https://githubcom/jabref/jabref/pull/2891
1.0,0.0,0.0,1.0,0.0,0.0,0.0,0.0,0.0,1.0,1.0,0.0,3092,1.0,0.0,0.0,1.0,0.0,0.0,0.0,0.0,0.0,1.0,1.0,0.0,fetcher timestamp,3074,|| thank you for your report :+1:this should be fixed in current `master` please try the latest build from  || this should be fixed in the latest development version could you please check the build from  thanks! || i checked the latest master build and the behavior is as expected now thanks!
1.0,0.0,0.0,1.0,0.0,0.0,0.0,0.0,0.0,1.0,1.0,0.0,3506,1.0,0.0,0.0,1.0,0.0,0.0,0.0,0.0,0.0,1.0,1.0,0.0,3359: automatically remove colon and apostrophe from key pattern,   -->3359 colons and apostrophes are now removed from the generated key patterni also refactored the key generator mainly converting the static methods to instance methods-----  change in changelogmd described-  -   ()-  manually tested changed features in running jabref-   ( [helpjabreforg](  if you changed the localization: did you run `gradle ate`?,|| could you please re-check the behavior with the most recent development version available here:  and report what you find?since the release of 40 there have been changes in the key generation which might also have affected this || sorry on my mac it says things like file damaged and should be moved to trash your faq says i can avoid this by changing the security setting to allow apps from anywhere but i dont have this option on my os (sierra 10126) || i can verify that this happens in the latest 11-13 build on windows:```jabref 41-dev--snapshot--2017-11-13--master--c1d425a31windows 10 100 amd64 java 180_152```not only the special characters like colon or ` are kept in the key phrase i also think it is not necessary to keep the curly brackets in the file name when the pdf file is downloaded from the fetcher automatically based on the bibtex information (the curly brackets are from the title entry in the bibtex code) but this could be a separate issue  || this should be fixed in the latest development version could you please check the build from  thanks!
1.0,0.0,1.0,1.0,0.0,0.0,0.0,0.0,0.0,1.0,1.0,0.0,4355,0.0,0.0,0.0,0.0,0.0,0.0,0.0,0.0,0.0,0.0,0.0,0.0,auto trim url field,        ( (      because github does not support autolinking there -->fixes 4288]created a formatter to auto trim all kinds of whitespace defined by java-----  change in changelogmd described-  -  manually tested changed features in running jabref-   () _no need_-  (   ( [helpjabreforg](https://githubcom/jabref/helpjabreforg/issues)?),|| i thought opening and closing spaces were automatically trimmed for each field before? || cant seem to pinpoint where url fields are to be trimmed the only method that seems to deal with urls is in modsexporterjava called addurl i added code to trim url but doesnt reflect in the application does anyone know what i am missing?  || hithe right place is in the entry editor i saw that there is already a paste handler for the the url field in the fieldseditors class   i think it should be sufficient to create a copy of the  removenewlinesformatter which only removes newlines before the first opening brace and the last closing brace and then add this as paste handler to the code area || thanks to @songyu-wang this should be fixed in the latest development version could you please check the build from  thanks! please remember to make a backup of your library before trying-out this version
