Network_x,DB_x,Interpreter_x,Logging_x,Data Structure_x,i18n_x,Setup_x,Microservices_x,Test_x,IO_x,UI_x,App_x,prNumber,Network_y,DB_y,Interpreter_y,Logging_y,Data Structure_y,i18n_y,Setup_y,Microservices_y,Test_y,IO_y,UI_y,App_y,issueTitle,issueBody,issue_Comments
0.0,0.0,0.0,1.0,0.0,0.0,0.0,0.0,0.0,1.0,1.0,0.0,491,0.0,0.0,0.0,1.0,0.0,0.0,0.0,0.0,0.0,1.0,1.0,0.0,add close all/others/ in database tab menu,see #314,|| :+1: :sunglasses:  || continue discussion in pr #491
1.0,0.0,1.0,1.0,0.0,0.0,0.0,0.0,0.0,1.0,1.0,0.0,677,1.0,0.0,1.0,1.0,0.0,0.0,1.0,0.0,0.0,1.0,1.0,0.0,make bibtex parser more robust against missing newlines,as described in #669 and #621 the parser has some problems when an entry (or preamble) follows directly the file encoding header (on the same line) ie `% encoding: myencoding @article{}`actually as the tests reveal it was not a problem with the actual parser but within the file opening logic i dont view this pr as a complete fix for #669 and #621 since not just the parser but also the serialization should be improvedalso fix a bug that prevented the import of bibtex entries having only a key as its content,|| related #621 || @tobiasdiez is this fixed? || @stefan-kolb it will be fixed with #718  || too late in the evening should have seen that myself :smile: :+1:
1.0,0.0,0.0,1.0,1.0,0.0,0.0,0.0,0.0,1.0,0.0,0.0,915,1.0,0.0,0.0,1.0,1.0,0.0,0.0,0.0,0.0,1.0,0.0,0.0,add button in preference dialog to reset preferences,implements #455 and/or   change in changelogmd described?-  ? ( )-  ? - only ui change-  ?,|| you can reset the preferences by starting jabref with `java -jar jabref-211jar --prdef all -n` || we dont really need two issues in different repositories for the very same thing do we? is enough
1.0,0.0,0.0,1.0,0.0,0.0,0.0,0.0,0.0,1.0,1.0,0.0,1056,1.0,0.0,0.0,1.0,0.0,0.0,0.0,0.0,0.0,1.0,1.0,0.0,fixes npe in export to external db,fixes npe in export to external dbadd db type to export succesful messagereformatting#1055no changelog because i think it was new introduced by the redesign of the entry sorting (passing null),|| i am looking into that seems like i found the problem || yes someone still passes `null` to the entries argument which was the old version to indicate that all entries should be sorted  || @tobiasdiez  yep there is missing a getselectedentries() as parameter || hmm i thought that i (ie eclipse) had found all performexport calls but obviously not
0.0,0.0,0.0,1.0,0.0,0.0,0.0,0.0,0.0,1.0,1.0,0.0,1298,0.0,0.0,0.0,0.0,0.0,0.0,0.0,0.0,0.0,1.0,0.0,0.0,added option to copy version information in the about dialog,added option to copy version information of jabref in the about dialog as described in #871 this will help with filing issues and bug reports as the version of jabref os and java will be copied -  change in changelogmd described-  -   ()![screen shot 2016-04-25 at 22 38 58](https://cloudentcom/assets/15340757/14798171/915a5bbc-0b36-11e6-8bbf-b01cb100b2cdpng),|| additionally i note some weird characters among the author names they appear both on your screenshot and on my linux computer || the weird characters are because of [gradle-1267]( fixed by  which is not integrated yetsee also #682 || see intelij copy to clipboard link in about dialog || @boceckts could you port the copy and paste from #964 to the `master` branch (without javafx libraries)? || refs #968 (javafx) and #1298 (swing) i think its solved
0.0,0.0,1.0,1.0,0.0,0.0,0.0,0.0,0.0,1.0,1.0,0.0,1318,0.0,0.0,0.0,0.0,0.0,0.0,0.0,0.0,1.0,1.0,0.0,0.0,update localization instructions,corrected gradlew task name#1312@koppor  @stefan-kolb,|| in my other pr  #1265   already changed the error/info text output of the consistencytest  output to the new gradle task name edit// linked wrong pr || @siedlerchr wrong pr referenced?
1.0,0.0,1.0,1.0,0.0,0.0,0.0,0.0,0.0,1.0,1.0,0.0,1397,1.0,0.0,1.0,1.0,0.0,0.0,1.0,0.0,0.0,1.0,1.0,0.0,add fields for nbibimporter and add testfile,regarding: 1063]( medlineplain importer doesnt have all fields that the nbib format has so i added the fields to the medlineplain format and added a test+ testfile for the nbib formata list of the elements that should be imported now can be found [here](  ,|| at least for their xml fomat there is a simple xsl-script: i found a kind of reference-field-list for the nbib-medline format and their meanings: with this table: || hm we got a medline fetcher whats the difference between our medline/medline plain and nbib? || medline plain is a subset of nbib so every field of medline plain is also a field of nbib but not every nbib field is in the medline plain format i will prepare a pr where i add the fields to the medline plain importerafter that i will take care of medline and nbib || ive added the nbib fields to medline and medlineplain so i think this issue can be closed now
1.0,0.0,0.0,1.0,0.0,0.0,0.0,0.0,0.0,1.0,0.0,0.0,1429,1.0,0.0,0.0,1.0,0.0,0.0,0.0,0.0,0.0,1.0,0.0,0.0,1342: show description of case converters as tooltip,<describe the changes you have made here:  >-  change in changelogmd described-  -   (),|| this was supported in a previous jabref version but was changed to have standardized names due to  the save actions || in that case will the right-click menu be disappearing from the interface?  i like the idea of consistency applied through save actions / clean-up  however if a user is interactively using the feature when entering text in a box it would seem better to have context immediately provided || we add a tooltip with the description what the formatter does when hovering over the action in the right-click menu this should suffice :) || a tooltip would be great thanks!
0.0,0.0,1.0,1.0,0.0,0.0,0.0,0.0,0.0,1.0,1.0,0.0,1453,0.0,0.0,1.0,1.0,0.0,0.0,0.0,0.0,0.0,1.0,1.0,0.0,refactor placement of parsing and writing logic,according to the following conventions:- all objects which can be read from a string have `public static type parse(stringy input)` method- all objects which can be written to a string have a `public stringy getasstring()` methodshould 888## -  change in changelogmd described-  -   (),|| my 2 cents: for the file field we provided a class that can convert from string to list<parsedfilefield> and back to me the bibwriter and bibparser know how to write bibentries using key/value pairs of strings and metadata in its general format all other information should be part of such converter classesbut i am not sure whether this approach is currently feasible for the metadata as its serialization and parsing is highly customized and does not follow a general scheme as the bibtex structure does || i have been dealing with the serialization of `metadata` a lot lately i can say that it is feasible to extract this logic currently it is quite localized in private methods in the parser and writer and we should be able to move it without too much effort the difficult part about serializing `metadata` is that every tag has very specific serialization conventions which requires a lot of if/elseif structuring moreover i dont think this will require a lot of new classes after all for what kind of data do we need such transformers? `metadata` `customentrytype` what else?the parser and writer would benefit from a simplifaction so i am for moving this logic
0.0,0.0,0.0,0.0,0.0,0.0,0.0,0.0,0.0,0.0,1.0,0.0,1599,1.0,0.0,0.0,1.0,0.0,1.0,0.0,0.0,0.0,1.0,1.0,0.0,fixed #1592,this should 1592-  change in changelogmd described,|| there is a version that should fix this at  (in 15 minutes or so) please try it out || it works as expected nowthanks for fixing it so quickly!
1.0,0.0,0.0,1.0,0.0,0.0,0.0,0.0,0.0,1.0,1.0,0.0,1671,1.0,0.0,0.0,1.0,0.0,0.0,0.0,0.0,0.0,1.0,1.0,0.0,1288 newly opened bib-file is not focused,-  open a new file and it is correctly focused afterwards-  open a file that was already opened before is correctly focused afterwards-  open a file two times and it is only opened once,|| should be a focus thing inside `jabrefguijava` near line 108
0.0,0.0,0.0,1.0,0.0,0.0,0.0,0.0,0.0,1.0,1.0,0.0,1942,1.0,0.0,1.0,1.0,0.0,0.0,0.0,0.0,0.0,1.0,0.0,0.0,mods importer,regarding: #1920 adds an importer for the mods (xml) format the importer is written with a jaxb parserdetails on the format and the newest xml schema can be found [here]( used the newest schema (version 36)-  change in changelogmd described-  -  manually tested changed features in running jabref,|| +1 || i will close this as everything seems to be done
1.0,0.0,1.0,1.0,0.0,0.0,1.0,0.0,0.0,1.0,1.0,0.0,1944,1.0,0.0,1.0,1.0,0.0,0.0,1.0,0.0,0.0,1.0,1.0,0.0,try around with xmlunit,   -->see #1943 for details -  change in changelogmd described-  -   ()-  manually tested changed features in running jabref-   ( [helpjabreforg](https://githubcom/jabref/helpjabreforg/issues)?),
1.0,0.0,1.0,1.0,0.0,0.0,1.0,0.0,0.0,1.0,1.0,0.0,1981,1.0,0.0,1.0,1.0,0.0,0.0,1.0,0.0,0.0,1.0,1.0,0.0,icon does not change when toggling global search,issue: #1979,
0.0,0.0,0.0,1.0,0.0,0.0,0.0,0.0,0.0,1.0,1.0,0.0,2163,0.0,0.0,0.0,0.0,0.0,0.0,0.0,0.0,1.0,1.0,0.0,1.0,fix highlighting issues,2133earlier highlighting was done manually by adding tags to matches in the html text being sent to the pane instead i have opted to make use of the highlighting features of the jeditorpane class this gives the additional benefit that the highlight colour is changed automatically based on the system theme changes - created jeditorpanewithhighlighting class- removed matchhighlighter class and its tests- removed highlighting related tests from layoutentrytest-  change in changelogmd described-  -   ()-  manually tested changed features in running jabref-   ( [helpjabreforg](  if you changed the localization: did you run `gradle ate`?,
0.0,0.0,0.0,1.0,0.0,0.0,0.0,0.0,0.0,1.0,1.0,0.0,2179,0.0,0.0,1.0,1.0,0.0,0.0,0.0,1.0,0.0,1.0,1.0,0.0,clear bibtexkey exception,2177 nullpointerexception caused by clearing bibtexkey field in entry editor-  change in changelogmd described-  -   ()-  manually tested changed features in running jabref-   ( [helpjabreforg](  if you changed the localization: did you run `gradle ate`?,|| another related bug which is more visible to the end usersteps to reproduce:1 open database2 edit some field for an entry3 open another entry and clear its bibtexkey4 save database5 quit jabref (by pressing ctrl-q or from the menu) and select discard changes when prompted![jabref waiting for save operation to finish](https://cloudentcom/assets/544054/19501176/61b5de02-9571-11e6-8adf-14efd6a59ae3png)
1.0,0.0,0.0,1.0,0.0,0.0,0.0,0.0,0.0,1.0,0.0,0.0,2400,1.0,0.0,0.0,1.0,0.0,0.0,0.0,0.0,0.0,1.0,0.0,0.0,2394 groups matching with brackets in name,2394-  change in changelogmd described-  -   ()-  manually tested changed features in running jabref-   ( [helpjabreforg](  if you changed the localization: did you run `gradle ate`?,|| thanks for reporting this issue it should be fixed in the latest development version could you please check the build from  thanks! || thanks works perfectly
0.0,0.0,1.0,1.0,0.0,0.0,0.0,0.0,0.0,1.0,1.0,0.0,2614,0.0,0.0,0.0,0.0,0.0,0.0,0.0,1.0,0.0,1.0,1.0,0.0,cleanup window has a scrollbar now,fix for issue #2501-  change in changelogmd described-  -   ()-  manually tested changed features in running jabref-   ( [helpjabreforg](  if you changed the localization: did you run `gradle ate`?,|| i tried to fix the layout stuff in #2415 i could not really test it so i would ask you to test that version  as soon as the tests run through  || no resize for cleanup window using ````jabref-400-dev--snapshot--2017-02-03--movefiledir--07a1c4477jar```` || this has been fixed with #2614 - and is now included in the dev builds
0.0,0.0,0.0,1.0,0.0,0.0,0.0,0.0,0.0,1.0,1.0,0.0,2711,0.0,0.0,0.0,0.0,0.0,0.0,0.0,0.0,0.0,0.0,0.0,0.0,avoid conversion of single underscores,2664single underscores that are not followed by `{` are not converted to unicode during the latex to unicode conversion this is not actually correct according to the rules of latex but seems to be an important exception required by our usersthis is achieved by the following: 1 replace all single underscores with `jabrefunderscore` 2 do the unicode conversion 3 replace `jabrefunderscore` with an underscoretodo: we should find a better magic word instead of `jabrefunderscore` because every character will be processed by latex2unicode and that costs performance however it should still be long and unique enough so that we avoid accidental conversions suggestions anyone?-  change in changelogmd described-  -  manually tested changed features in running jabref,|| is it possible to file an issue at  || hmm i think the behavior of determining subscript is consistent with latex (although if not in the math environment a compile error would be thrown) in other words i guess latex2unicode is doing its job as intended?maybe jabref can add some extra logic to determine when latex2unicode should kick in? || when interpreting `_` with latex the `_` command is a command stating that the following character should be go to subscript if one does not want that one has to load the [underscore]( package see  jabref should escape the underscore when doing the conversion (this assumes that the user loads the underscore package)? or warn the user?  || solution idea: `_` is only converted if followed by `_{} ` - idea: replace _ by arbitrarystring then convert to unicode and then convert back || @tomtung probably in `text_u` the `u` should be converted to subscript letter in unicode and show it as textᵤ || @tobiasdiez yeah thats the current behavior also i use `_(whatever)` to represent subscript when there are no corresponding unicode subscript characters available
0.0,0.0,0.0,0.0,0.0,0.0,0.0,0.0,0.0,1.0,1.0,0.0,2972,1.0,0.0,1.0,1.0,0.0,0.0,0.0,1.0,0.0,1.0,1.0,0.0,add remove link context menu entry in file editor,   -->fix for #2968 (  change in changelogmd described-  -   ()-  manually tested changed features in running jabref-   ( [helpjabreforg](  if you changed the localization: did you run `gradle ate`?,|| thank you for reporting this issue we think that is already fixed in our development version and consequently the change will be included in the next releasewe would like to ask you to use a development build from  and report back if it works for you
0.0,0.0,0.0,1.0,0.0,0.0,0.0,0.0,0.0,1.0,1.0,0.0,2995,0.0,0.0,0.0,1.0,0.0,0.0,0.0,0.0,0.0,1.0,0.0,0.0,less backups,addresses #2993the frequent events are due to the bidirectional binding which transfers every change directly into the bibentry if we want fewer events the only solution will probably be to break the binding which would be very disappointing for the javafx implementation in my point of view the problem is not on the side of event creation after all every change should trigger an event and javafx triggers many changes imho this should be fixed in how we react to eventsi also noticed the exception but do not get a dialog this seems to happen because of the save operation invoked by the backupa solution might be to do less backups by: 1 doing backups only every x events and not for every event 2 ignoring fieldchangeevents in the backup 3 adding the size of the field change in the fieldchangeevent class so that you can ignore it if only 1 character changedthis pr combines options 1 and 3 ie: the backup manager ignores events that are very minor and only does a backup if enough of them have happened (currently set to five)what do you think?-  change in changelogmd described-  -   ()-  manually tested changed features in running jabref-   ( [helpjabreforg](  if you changed the localization: did you run `gradle ate`?,|| fixed by #2995
0.0,0.0,1.0,1.0,0.0,0.0,0.0,0.0,0.0,1.0,1.0,0.0,3007,0.0,0.0,1.0,1.0,0.0,0.0,0.0,0.0,0.0,1.0,1.0,0.0,add preference migration for keybdingings,fix for #2980    -->-  change in changelogmd described-  -   ()-  manually tested changed features in running jabref-   ( [helpjabreforg](  if you changed the localization: did you run `gradle ate`?,|| preferencesmigrationsjava
0.0,0.0,1.0,1.0,0.0,0.0,0.0,0.0,0.0,1.0,1.0,0.0,3551,0.0,0.0,1.0,1.0,0.0,0.0,0.0,0.0,0.0,1.0,1.0,0.0,make path relative when adding automatically found file,3476   -->-----  change in changelogmd described-  -   ()-  manually tested changed features in running jabref-   ( [helpjabreforg](  if you changed the localization: did you run `gradle ate`?,|| hirelative links are created automatically and this depends on your settings there are 4 settings for files:1 checkbox: use bibfile as main file location -> overwrites all other settings2 main file directory globally in jabref valid for all files3 use and library setting in the properties of the bib file: here you can also enter relative pathso depending on your settings jabref will relatvize all paths against the first found file directory || hiall of these 3 were set in jabref 40 and are still set in the development version im using now (1 checked 2 set to `/home/bitzer/papers` and 3 set to `/home/bitzer/papers` too) still version 40 added relative paths while the development version adds absolute paths || is the location of the bibfile the same as /home/bitzer/papers? if not then uncheck the combobox || yes the bibfile is in /home/bitzer/papers itself also the issue persists in the newest version jabref-41-dev--snapshot--2017-12-08--master--6f39151a7jar || ah i now can reproduce your  behavior it is the auto link which adds it as absolute path if you manually select the file it is correct i will be working on a fix for this || cool thank you!
1.0,0.0,1.0,1.0,0.0,0.0,1.0,0.0,0.0,1.0,1.0,0.0,3600,1.0,0.0,1.0,1.0,0.0,0.0,1.0,0.0,0.0,1.0,1.0,0.0,make it possible to disable autocompletion in the search bar,3598 by covering the autocompletion in the search bar with the same preference option as in the entry editor -----  change in changelogmd described-  -   ()-  manually tested changed features in running jabref-   ( [helpjabreforg](  if you changed the localization: did you run `gradle ate`?,|| there is a preference option that you can set as part of the entry editor preferences which turns off the autocompletion there i think we should just extend the preference to capture the search box as well
1.0,0.0,1.0,1.0,0.0,0.0,1.0,0.0,0.0,1.0,1.0,0.0,3709,1.0,0.0,1.0,1.0,0.0,0.0,1.0,0.0,0.0,1.0,1.0,0.0,group separator escaping,3646,|| duplicate of #365
0.0,0.0,0.0,1.0,0.0,0.0,0.0,0.0,0.0,1.0,1.0,0.0,3766,0.0,0.0,0.0,1.0,0.0,0.0,0.0,0.0,0.0,1.0,1.0,0.0,update architecture tests to catch static imports,fixes a part of #2617updates the architecture tests to junit5 and also catches violations in static imports now i tested this by adding a static import and checking that the build breaks it does but of course i had to remove the cause again-----  change in changelogmd described-  -  manually tested changed features in running jabref-   ()-  (   ( [helpjabreforg](https://githubcom/jabref/helpjabreforg/issues)?),|| idea: there may be checkstyle rules that can be configured to cover our architecture tests || oh that was me fixed this instance in #2618 unfortunately i dont have time to investigate 2however i am happy to have raised attention to this problem by committing this mistake || further architecture related desirable tests are:- logic and viewmodel: no javafx except javafxcollections- view viewmodel and controller: no globals and jabrefgui no direct fxdialogservice- all fxml files can be loaded successfully- no fetcher is used directly outside of the import package || there is a new tool called archunit maybe this is helpful https://githubcom/tng/archunit
0.0,0.0,0.0,1.0,0.0,0.0,0.0,0.0,0.0,1.0,1.0,0.0,3968,0.0,0.0,0.0,1.0,0.0,0.0,0.0,0.0,0.0,1.0,1.0,0.0,fix ieee fetcher by enabling cookie support,3966 apparently when in vpn network of university ieee fulltext fetcher needs cookie support enabled        ( (      because github does not support autolinking there -->-----  change in changelogmd described-  -  manually tested changed features in running jabref-   ()-  (   ( [helpjabreforg](https://githubcom/jabref/helpjabreforg/issues)?),|| the test for open access articles such as  workthere should be no difference for the other articles as long as you really have accessit is hard to debug for me as i dont have ieee access at university @jabref/developers anyone of you has access? || i can reproduce this error for me the ieee fetcher tests fail when i am connected using university vpnthe html page  i get from the url downloader talks about missing cookie support i will see if i can fix that  || thank you for reporting this issue we think that is already fixed in our development version and consequently the change will be included in the next releasewe would like to ask you to use a development build from  and report back if it works for you || no please read the text very carefullyi have explicitly mentioned that i am using the latest developmental version the problem still persists please reopen this issue || we just merged a pull request fixing it || @krishnakumarg1984  yes i know but i just merged the code into the master branch the development build gets automatically updated and built by our ci servers whenever someone commits to the master branch this usually takes a couple of minutes the version string contains the first part of the commit id  (help-> about)  || ah i am so sorry for not correctly interpreting what you said i shall try the latest development build and report back sorry for the mild confusion in my last post || @siedlerchr  @stefan-kolb we may have to reopen this issuei just tried with the latest build>>jabref 42-dev--snapshot--2018-04-20--master--8bbc40e13>windows 7 61 x86 >java 180_161from my universitys network and same error pop-up message persists   curiously the event log in jabref is empty i wonder why #3968 says the problem is only with vpn access? i am currently physically on the campus library on a windows 7 machine hard-wired to the network with a lan cable  just to confirm that this is indeed a persisting bug there is no issue with full-text access to this article from a standard browser pointed to the url   || i think @krishnakumarg1984 is right and the issue still persist just looking at the code never going to match ` || hmm thats odd i will look into that again tomorrow  || @krishnakumarg1984  i just merged the fix which supports those the ieee document urls you have like in your entry  and i also tested your entry with university access and worked for me so i would like you to test this again || @siedlerchr  thank you i shall go to university to check this out will report back soon || woohoo you guys are amazing i just tried the latest master-build from my universitys network and can confirm that this is now fixed  was able to download the full-text of the bibtex entry for which the issue was opened thank you for accepting and pro-actively working to fix this issue#### version info of jabref build used:>jabref 42-dev--snapshot--2018-04-21--master--5c664e1d2>windows 7 61 x86 >java 180_161
1.0,0.0,1.0,1.0,0.0,0.0,0.0,0.0,0.0,1.0,1.0,0.0,4184,0.0,0.0,1.0,1.0,0.0,1.0,0.0,0.0,0.0,1.0,1.0,0.0,3062: ctrl + f selects search field again,        ( (      because github does not support autolinking there -->shortcut was simply not registered also remove a bit of legacy code which is no longer needed-----  change in changelogmd described-  -  manually tested changed features in running jabref-   ()-  (   ( [helpjabreforg](https://githubcom/jabref/helpjabreforg/issues)?),|| i debugged a bit and the action is correclty recognized and the method to requestfocus is called but somehow the textfield is not focused maybe @tobiasdiez  has an idea because he changed that together with the autocompletioni even tried to wrap it in a platformrunlater call but that did not work || happens again in the `maintable-beta` branch as discussed in the devcall i should open issues for issues with that branch (which will become the master branch)
0.0,0.0,0.0,1.0,0.0,0.0,0.0,0.0,0.0,1.0,1.0,0.0,4212,0.0,0.0,0.0,0.0,0.0,0.0,0.0,0.0,0.0,1.0,1.0,0.0,make attached files relative to the file directory,4201        ( (      because github does not support autolinking there -->-----  change in changelogmd described-  -  manually tested changed features in running jabref-   ()-  (   ( [helpjabreforg](https://githubcom/jabref/helpjabreforg/issues)?),|| did you add the pdf manually or did you use a fetcher?as far as i remember there was nothing changed in the behavior maybe a cleanup call is needed i currently have the code not at hand  || sorry for the delay:i used the rightclick add file for adding the pdf || it only happens if you use rightclick on entry -> attach fileinside the general tab it works fine  || thank you for reporting this issue we think that is already fixed in our development version and consequently the change will be included in the next releasewe would like to ask you to use a development build from  and report back if it works for you please remember to make a backup of your library before trying-out this version
